{
  "$schema": "./tavern-card-v3-format.schema.json",
  "name": "Tavern Card v3 Single File Format Knowledge Base",
  "language": "zh-CN",
  "updated_at": "2026-05-04",
  "sources": [
    "https://github.com/malfoyslastname/character-card-spec-v3",
    "https://docs.sillytavern.app/usage/core-concepts/characterdesign/"
  ],
  "scope_note": "本文件用于奶龙工具箱识别/审查 Tavern Card v3 单文件结构和内嵌资产字段。整卡解包、回包、构建、发布属于奶龙王一键制卡流程。",
  "top_level_fields": {
    "spec": "角色卡规范标识；v3 常见为 chara_card_v3。",
    "spec_version": "规范版本。",
    "data": "角色卡主体数据对象。"
  },
  "data_fields": {
    "name": "角色名。",
    "description": "角色描述。",
    "personality": "性格。",
    "scenario": "场景。",
    "first_mes": "默认开场白。",
    "alternate_greetings": "额外开场白数组。",
    "creator_notes": "作者说明。",
    "character_book": "内置世界书。",
    "extensions": "扩展字段容器，用于 ST、插件或制卡工具保存额外资产。"
  },
  "extension_fields": {
    "regex_scripts": "可能出现在 data.extensions 或 ST 扩展字段中的角色卡内 Regex 脚本列表。",
    "tavern_helper": "可能保存酒馆助手脚本或相关元数据的扩展字段；编辑前需确认来源。",
    "assets": "图片、音频、扩展资源等引用或内嵌信息；往返维护时应保留未知字段。"
  },
  "asset_preservation": [
    "审查单文件时优先保留未知 extensions 字段。",
    "不要因为 schema 未列出就删除 data.extensions、character_book、regex_scripts 或工具私有字段。",
    "不要把 examples 中的占位角色卡当作真实业务正文来源。"
  ],
  "toolbox_boundary": [
    "奶龙工具箱只做单文件识别、审查、小范围字段维护和知识库说明。",
    "用户要求解包、回包、构建、发布、批量修改整卡时，应路由到奶龙王一键制卡。",
    "处理 _inbox 中疑似角色卡文件时，应先报告判断结果并等待确认，不自动移动或解包。"
  ]
}
